Title,Count,URL
Emploi vente et commercial,54,https://www.expat-dakar.com/emploi-vente-commercial
Emploi services à la personne,43,https://www.expat-dakar.com/emploi-services-a-la-personne
Emploi marketing et communication,22,https://www.expat-dakar.com/emploi-marketing-communication
Emploi transport et logistique,12,https://www.expat-dakar.com/emploi-transport-logistique
Emploi enseignement et formation,10,https://www.expat-dakar.com/emploi-enseignement-formation
Emploi restauration,9,https://www.expat-dakar.com/emploi-restauration
Emploi service client et support technique,7,https://www.expat-dakar.com/emploi-service-client-support-technique
Emploi informatique,6,https://www.expat-dakar.com/emploi-informatique
Emploi médical et santé,5,https://www.expat-dakar.com/emploi-medical-sante
Emploi social,5,https://www.expat-dakar.com/emploi-social
Emploi administratif,4,https://www.expat-dakar.com/emploi-administratif
Emploi hygiène et sécurité,4,https://www.expat-dakar.com/emploi-hygiene-securite
Emploi ressources humaines,4,https://www.expat-dakar.com/emploi-ressources-humaines
